review,class,text_for_models,text_for_stats,detected_aspects,aspects_parsed,aspect_sentiments,sentiments_parsed
"This place is a wonder.  All kinds of sausages, and meats.  I'm a real push over for smoked meat.  I especially like their lachs schinken which is smoked ham cut very thin.  Making soup  Try it with a smoked pork haxen.  Another favorite is their fleisch salat.  But beware, the fleisch salat is put into a container without weighing so the price of each container may not be what you think it will be.....close but not exact.Great place and like all German butcher shops, it's closed on Monday.
",1,"this place is a wonder. all kinds of sausages, and meats. i am a real push over for smoked meat. i especially like their lachs schinken which is smoked ham cut very thin. making soup try it with a smoked pork haxen. another favorite is their fleisch salat. but beware, the fleisch salat is put into a container without weighing so the price of each container may not be what you think it will be.....close but not exact.great place and like all german butcher shops, it is closed on monday.",place wonder kind sausage meat real push smoked meat especially like lachs schinken smoke ham cut thin make soup try smoked pork haxen another favorite fleisch salat beware fleisch salat put container without weigh price container may think close exact great place like german butcher shop close monday,"{'value for money': 0.97, 'product quality': 0.678}","{'value for money': 0.97, 'product quality': 0.678}","{'value for money': 'NEGATIVE', 'product quality': 'NEGATIVE'}","{'value for money': 'NEGATIVE', 'product quality': 'NEGATIVE'}"
"Quick service, amazing coffee, nice vibe.
",1,"quick service, amazing coffee, nice vibe.",quick service amaze coffee nice vibe,"{'product quality': 0.871, 'value for money': 0.641, 'functionality': 0.584}","{'product quality': 0.871, 'value for money': 0.641, 'functionality': 0.584}","{'product quality': 'POSITIVE', 'value for money': 'POSITIVE', 'functionality': 'POSITIVE'}","{'product quality': 'POSITIVE', 'value for money': 'POSITIVE', 'functionality': 'POSITIVE'}"
"Sir Ed's is a local's restaurant and bar and, as such, is perfect.Note to non-locals: you will find a warm welcome.Part of the attraction of Sir Ed's is the 'hidden' location down an alley between the ski store and Rack Room Shoes. Head down the stairs and through the door without the sign and you're in a special place.You'll find...A sensibly-priced menu with a curious mix of pub favorites, Mexican-inspired dishes, and some simply way-out-there items. There's plenty for the vegetarian and even the vegan.A great staff including two of Charlotte's top bartenders.A superb patio in the warmer months plus a great 'warm and cozy' feel in the winter.Full menu until 2 a.m. every nightmorning.A generally civilized atmosphere.You can hear what the person next to you is saying even when Sir Ed's is full.A great lunch menu with some excellent deals.Full bar with an always interesting selection of beers and wines.There's a reason that 'Sir Ed's virgins' become regulars. It's a special place.You also get free birthday on your dinner.Go to this link. http:eepurl.comg_TTA
",1,"sir ed's is a local's restaurant and bar and, as such, is perfect.note to non-locals: you will find a warm welcome.part of the attraction of sir ed's is the 'hidden' location down an alley between the ski store and rack room shoes. head down the stairs and through the door without the sign and you are in a special place.you will find...a sensibly-priced menu with a curious mix of pub favorites, mexican-inspired dishes, and some simply way-out-there items. there is plenty for the vegetarian and even the vegan.a great staff including two of charlotte's top bartenders.a superb patio in the warmer months plus a great 'warm and cozy' feel in the winter.full menu until 2 a.m. every nightmorning.a generally civilized atmosphere.you can hear what the person next to you is saying even when sir ed's is full.a great lunch menu with some excellent deals.full bar with an always interesting selection of beers and wines.there is a reason that 'sir ed's virgins' become regulars. it is a special place.you also get free birthday on your dinner.go to this link. http:eepurl.comg_tta",sir ed local restaurant bar perfect note non local find warm welcome part attraction sir ed hidden location alley ski store rack room shoe head stair door without sign special place find sensibly price menu curious mix pub favorite mexican inspired dish simply way item plenty vegetarian even vegan great staff include two charlotte top bartender superb patio warm month plus great warm cozy feel winter full menu 2 every nightmorning generally civilize atmosphere hear person next say even sir ed full great lunch menu excellent deal full bar always interesting selection beer wine reason sir ed virgins become regular special place also get free birthday dinner go link http eepurl comg tta,"{'value for money': 0.987, 'design and aesthetics': 0.928, 'content quality': 0.714, 'product quality': 0.656}","{'value for money': 0.987, 'design and aesthetics': 0.928, 'content quality': 0.714, 'product quality': 0.656}","{'value for money': 'POSITIVE', 'design and aesthetics': 'POSITIVE', 'content quality': 'POSITIVE', 'product quality': 'POSITIVE'}","{'value for money': 'POSITIVE', 'design and aesthetics': 'POSITIVE', 'content quality': 'POSITIVE', 'product quality': 'POSITIVE'}"
"Most people will try to tell you that Zia Records is the best record store in the valley. Those people would be correct.Why the low score, then Because being Crown Prince of the Turd Playground that is Phoenix's record store selection is not exactly a glowing accomplishment. This store does several things wrong.For one, this location in particular pesters the shite out of you. ""Are you finding everything alright"", ""Are you finding everything alright"" YES! Jesus Christ, I was finding everything alright the first four times you asked me, now be a good little retail monkey and leave me the bloody hell alone so I can shop and eventually give you my money!I'm sure it's this economy business that's to blame, and not necessarily corporate nonsense, but someone needs to take their manager out back and explain that annoying the piss out of your customers may actually be worse than ignoring them. And it's just this store! I went to the T-Bird location and wasn't bothered. Someone casually asked me if there was anything I needed, and I said ""No"" and was done with it. But at this store, I was literally asked three separate times by the SAME IDIOT if I was finding everything okay!Perhaps it was the annoying tunes they had playing that added to the grating atmosphere. Censored Rap (Not that I'm a fan, but hearing the song go silent every five seconds to omit a blatant swear is fairly tiresome after awhile) 70's Funk and bad Butt Rock seem to be on the menu ad nauseum. Though, in fairness, perhaps it's just the staff during the morning or something. I notice at night it gets a bit better... if you can crawl out from beneath all the employees asking you if you're doing okay long enough to even notice.I've never gathered the courage to stand in the line of leering meth addicts at the Trade Counter to tell you whether they give decent store credit for used stuff, though, so I'll leave it to greater minds to judge that facet of their business model. I will say that their used stuff is in good enough shape... if you don't count the bleeding stickers they put on absolutely everything! You inevitably spend twice the time you would have spent actually listening to your purchase doing nothing but peeling tape and stickers. They're worse than Gamestop, that way. I payed for it, it's mine. Why are you putting your ugly stickers all over my albumBad neighbourhood, too.I hate to sound so negative without balancing out with some positive, but the experience is fairly fresh in my mind as I just went earlier today. I guess their prices are good, unless you want something newish. In which case, bending over and having plenty of lube handy is the best advice I can offer.Just know what you want. Go in. Get out. And for god's sake, avoid their overzealous employees as if they were landmines.Or just give the constant irritants a pass and go to a different location. Or Bookman's. I know I will.
",0,"most people will try to tell you that zia records is the best record store in the valley. those people would be correct.why the low score, then because being crown prince of the turd playground that is phoenix's record store selection is not exactly a glowing accomplishment. this store does several things wrong.for one, this location in particular pesters the shite out of you. ""are you finding everything alright"", ""are you finding everything alright"" yes! jesus christ, i was finding everything alright the first four times you asked me, now be a good little retail monkey and leave me the bloody hell alone so i can shop and eventually give you my money!i am sure it is this economy business that is to blame, and not necessarily corporate nonsense, but someone needs to take their manager out back and explain that annoying the piss out of your customers may actually be worse than ignoring them. and it is just this store! i went to the t-bird location and was not bothered. someone casually asked me if there was anything i needed, and i said ""no"" and was done with it. but at this store, i was literally asked three separate times by the same idiot if i was finding everything okay!perhaps it was the annoying tunes they had playing that added to the grating atmosphere. censored rap (not that i am a fan, but hearing the song go silent every five seconds to omit a blatant swear is fairly tiresome after awhile) 70's funk and bad butt rock seem to be on the menu ad nauseum. though, in fairness, perhaps it is just the staff during the morning or something. i notice at night it gets a bit better... if you can crawl out from beneath all the employees asking you if you are doing okay long enough to even notice.i have never gathered the courage to stand in the line of leering meth addicts at the trade counter to tell you whether they give decent store credit for used stuff, though, so i will leave it to greater minds to judge that facet of their business model. i will say that their used stuff is in good enough shape... if you do not count the bleeding stickers they put on absolutely everything! you inevitably spend twice the time you would have spent actually listening to your purchase doing nothing but peeling tape and stickers. they are worse than gamestop, that way. i payed for it, it is mine. why are you putting your ugly stickers all over my albumbad neighbourhood, too.i hate to sound so negative without balancing out with some positive, but the experience is fairly fresh in my mind as i just went earlier today. i guess their prices are good, unless you want something newish. in which case, bending over and having plenty of lube handy is the best advice i can offer.just know what you want. go in. get out. and for god's sake, avoid their overzealous employees as if they were landmines.or just give the constant irritants a pass and go to a different location. or bookman's. i know i will.",people try tell zia record best record store valley people would correct low score crown prince turd playground phoenix record store selection exactly glowing accomplishment store several thing wrong one location particular pesters shite find everything alright find everything alright yes jesus christ find everything alright first four time ask good little retail monkey leave bloody hell alone shop eventually give money sure economy business blame necessarily corporate nonsense someone need take manager back explain annoy piss customer may actually bad ignore store go bird location bother someone casually ask anything need say store literally ask three separate time idiot find everything okay perhaps annoy tune play add grating atmosphere censor rap fan hear song go silent every five second omit blatant swear fairly tiresome awhile 70 funk bad butt rock seem menu ad nauseum though fairness perhaps staff morning something notice night get bit well crawl beneath employee ask okay long enough even notice never gather courage stand line leer meth addict trade counter tell whether give decent store credit use stuff though leave great mind judge facet business model say use stuff good enough shape count bleed sticker put absolutely everything inevitably spend twice time would spend actually listen purchase nothing peel tape sticker bad gamestop way pay mine put ugly sticker albumbad neighbourhood hate sound negative without balance positive experience fairly fresh mind go early today guess price good unless want something newish case bending plenty lube handy best advice offer know want go get god sake avoid overzealous employee landmines give constant irritant pas go different location bookman know,{'content quality': 0.574},{'content quality': 0.574},{'content quality': 'POSITIVE'},{'content quality': 'POSITIVE'}
"I have been here one time and one time only. I will never go back. I took my two kids here since my son is into pokemon and my daughter loves my little ponies. Plus it's very close where we live. I tried to get one of the three people working to help us but they seemed more interested in avoiding helping us. My questions were answered with one word or a finger point. My daughter was able to find a couple of comics but we never did find the cards my son was pointed to. When we checked out the person behind the counter said is this it and rolled their eyes. Not the kind of experience i expected of a place geared to all ages. I was disappointed to say the least.
",0,i have been here one time and one time only. i will never go back. i took my two kids here since my son is into pokemon and my daughter loves my little ponies. plus it is very close where we live. i tried to get one of the three people working to help us but they seemed more interested in avoiding helping us. my questions were answered with one word or a finger point. my daughter was able to find a couple of comics but we never did find the cards my son was pointed to. when we checked out the person behind the counter said is this it and rolled their eyes. not the kind of experience i expected of a place geared to all ages. i was disappointed to say the least.,one time one time never go back take two kid since son pokemon daughter love little pony plus close live try get one three people work help us seem interested avoid help us question answer one word finger point daughter able find couple comic never find card son point check person behind counter say roll eye kind experience expect place gear age disappointed say least,{},{},{},{}
"One of my favorite places in Vegas! If you are visiting here and are not into gambling, this is a nice alternative. Here you can learn about our ecosystem and cultural history, enjoy art, and walk through some pretty nice trails! They also have some great exhibits and workshops supporting sustainable living.
",1,"one of my favorite places in vegas! if you are visiting here and are not into gambling, this is a nice alternative. here you can learn about our ecosystem and cultural history, enjoy art, and walk through some pretty nice trails! they also have some great exhibits and workshops supporting sustainable living.",one favorite place vega visit gamble nice alternative learn ecosystem cultural history enjoy art walk pretty nice trail also great exhibit workshop support sustainable living,{},{},{},{}
"Hey guys and gals!   As you know, I am a volunteer usher at the Benedum! Last night... SEINFELD!       Tonight.... CELTIC THUNDER!!!   I highly recommend buying a season certificate or a package deal to the Benedum! Next year is GREAT! ""Wicked""is the the featured attraction!    What a GREAT Christmas or birthday gift, Right      Do check into it and BUY!!!
",1,"hey guys and gals! as you know, i am a volunteer usher at the benedum! last night... seinfeld! tonight.... celtic thunder!!! i highly recommend buying a season certificate or a package deal to the benedum! next year is great! ""wicked""is the the featured attraction! what a great christmas or birthday gift, right do check into it and buy!!!",hey guy gal know volunteer usher benedum last night seinfeld tonight celtic thunder highly recommend buying season certificate package deal benedum next year great wicked featured attraction great christmas birthday gift right check buy,"{'value for money': 0.919, 'customer experience': 0.908, 'content quality': 0.74, 'product quality': 0.464}","{'value for money': 0.919, 'customer experience': 0.908, 'content quality': 0.74, 'product quality': 0.464}","{'value for money': 'POSITIVE', 'customer experience': 'POSITIVE', 'content quality': 'POSITIVE', 'product quality': 'POSITIVE'}","{'value for money': 'POSITIVE', 'customer experience': 'POSITIVE', 'content quality': 'POSITIVE', 'product quality': 'POSITIVE'}"
"Off the strip is a great place for kids to put pedal to the metal.  One kart track for the little ones, two for older kids, and one for over 16.  Looks as if they hold a number of kids' b-day parties here but don't pay that no mind because the action is outdoors.  Look in the What's On mag (available for free in hotels) for a coupon worth 1 free ride if you buy 2.   You'll need a rental car to get here because it's about 15 minutes from the Strip.
",1,"off the strip is a great place for kids to put pedal to the metal. one kart track for the little ones, two for older kids, and one for over 16. looks as if they hold a number of kids' b-day parties here but do not pay that no mind because the action is outdoors. look in the what is on mag (available for free in hotels) for a coupon worth 1 free ride if you buy 2. you will need a rental car to get here because it is about 15 minutes from the strip.",strip great place kid put pedal metal one kart track little one two old kid one 16 look hold number kid b day party pay mind action outdoors look mag available free hotel coupon worth 1 free ride buy 2 need rental car get 15 minute strip,"{'content quality': 0.793, 'value for money': 0.73}","{'content quality': 0.793, 'value for money': 0.73}","{'content quality': 'NEGATIVE', 'value for money': 'NEGATIVE'}","{'content quality': 'NEGATIVE', 'value for money': 'NEGATIVE'}"
"I gotta say.I've been in here a few times and each time I had a great time!Really great time!Singing along at the top of my lungs to Billy Joel songs great time!HOWEVERI've always stopped here after bar hopping a bit.  This was kinda the last stop... and we were all pretty buzzed each time we visited this place.I dunno.I have fond, fond memories of this place though.
",1,"i got to say.i have been in here a few times and each time i had a great time!really great time!singing along at the top of my lungs to billy joel songs great time!howeveri've always stopped here after bar hopping a bit. this was kind of the last stop... and we were all pretty buzzed each time we visited this place.i do not know.i have fond, fond memories of this place though.",get say time time great time really great time sing along top lung billy joel song great time howeveri always stop bar hop bit kind last stop pretty buzz time visit place know fond fond memory place though,{'content quality': 0.85},{'content quality': 0.85},{'content quality': 'POSITIVE'},{'content quality': 'POSITIVE'}
"Better than video games! I take my boys there and they love it! It's airconditioned and great exercise. They are continually improving and excited about little league next year.
",1,better than video games! i take my boys there and they love it! it is airconditioned and great exercise. they are continually improving and excited about little league next year.,good video game take boy love airconditioned great exercise continually improve excite little league next year,"{'functionality': 0.979, 'product quality': 0.618}","{'functionality': 0.979, 'product quality': 0.618}","{'functionality': 'POSITIVE', 'product quality': 'POSITIVE'}","{'functionality': 'POSITIVE', 'product quality': 'POSITIVE'}"
"Yum yum yum!!! LaTorre's is one of my favorite lunch spots and I'd highly recommend it to anyone who hasn't been!  My personal fave is the Pollo Chipotle sandwich with skinny fries.  Their food is amazing and the prices aren't too bad either.I have a slight issue with LaTorre's and here it is:  Once upon a time, I asked for the Cubano sandwich but with NO mustard.  Well, Mr. Waiter kindly informed me that their sandwiches are pre-made and they are unable to alter them in any way.  Hmm...pre-made hot sandwiches that are deliciously devine  I'm a skeptic.  After asking around, I found an inside source that said that their sandwiches are NOT pre-made but the managerschefs say that so that they don't get overwhelmed with nit-picky custom orders by my fellow corporate cube monkeys during the lunch rush.  My point:  the next time you want your Cubano with no mustard or extra sauce, don't believe the hype and make them customize it for you!  By the way, my spy happens to be an employee so I know it's true.  All in all, this place is great.
",1,"yum yum yum!!! latorre's is one of my favorite lunch spots and i would highly recommend it to anyone who has not been! my personal fave is the pollo chipotle sandwich with skinny fries. their food is amazing and the prices are not too bad either.i have a slight issue with latorre's and here it is: once upon a time, i asked for the cubano sandwich but with no mustard. well, mr. waiter kindly informed me that their sandwiches are pre-made and they are unable to alter them in any way. hmm...pre-made hot sandwiches that are deliciously devine i am a skeptic. after asking around, i found an inside source that said that their sandwiches are not pre-made but the managerschefs say that so that they do not get overwhelmed with nit-picky custom orders by my fellow corporate cube monkeys during the lunch rush. my point: the next time you want your cubano with no mustard or extra sauce, do not believe the hype and make them customize it for you! by the way, my spy happens to be an employee so i know it is true. all in all, this place is great.",yum yum yum latorre one favorite lunch spot would highly recommend anyone personal fave pollo chipotle sandwich skinny fry food amazing price bad either slight issue latorre upon time ask cubano sandwich mustard well mr waiter kindly inform sandwich pre make unable alter way hmm pre make hot sandwich deliciously devine skeptic ask around find inside source say sandwich pre make managerschefs say get overwhelm nit picky custom order fellow corporate cube monkey lunch rush point next time want cubano mustard extra sauce believe hype make customize way spy happen employee know true place great,"{'value for money': 0.818, 'product quality': 0.489}","{'value for money': 0.818, 'product quality': 0.489}","{'value for money': 'POSITIVE', 'product quality': 'POSITIVE'}","{'value for money': 'POSITIVE', 'product quality': 'POSITIVE'}"
"There is no doubting that I am an Aveda girl. Being in Phoenix and having plenty of Aveda salons around you would think I'd be beauty-heaven. But when I left Cleveland I was very hesitant to leave my hairdresser so I scheduled my hair appointments around when I'd be flying home. Well, as one could image, that become very expensive, so I finally decided to take a chance with Perry Monage downtown. I'm so glad I did! From the moment I walked in to the stylist, they were spot-on with customer service and they did an amazing job with my cut and color, too! There was a little up-selling me with products which I wasn't use to and I must admit, I did cave but I mean, Aveda, hello Can we say amazing!I'm still in love with Aveda and I'm now in love with Perry Monage.
",1,"there is no doubting that i am an aveda girl. being in phoenix and having plenty of aveda salons around you would think i would be beauty-heaven. but when i left cleveland i was very hesitant to leave my hairdresser so i scheduled my hair appointments around when i would be flying home. well, as one could image, that become very expensive, so i finally decided to take a chance with perry monage downtown. i am so glad i did! from the moment i walked in to the stylist, they were spot-on with customer service and they did an amazing job with my cut and color, too! there was a little up-selling me with products which i was not use to and i must admit, i did cave but i mean, aveda, hello can we say amazing!i am still in love with aveda and i am now in love with perry monage.",doubt aveda girl phoenix plenty aveda salon around would think would beauty heaven leave cleveland hesitant leave hairdresser schedule hair appointment around would fly home well one could image become expensive finally decide take chance perry monage downtown glad moment walk stylist spot customer service amazing job cut color little sell product use must admit cave mean aveda hello say amaze still love aveda love perry monage,"{'design and aesthetics': 0.991, 'value for money': 0.971, 'content quality': 0.671}","{'design and aesthetics': 0.991, 'value for money': 0.971, 'content quality': 0.671}","{'design and aesthetics': 'POSITIVE', 'value for money': 'POSITIVE', 'content quality': 'POSITIVE'}","{'design and aesthetics': 'POSITIVE', 'value for money': 'POSITIVE', 'content quality': 'POSITIVE'}"
