review,class,text_for_models,text_for_stats,detected_aspects,aspects_parsed,aspect_sentiments,sentiments_parsed
"So I'm going to tell you exactly why I gave this place 5 stars.1star: Customer service. The filipino lady working here is pretty awesome. I came in with 3 other friends and of course we asked for samples. :P She pretty much gave us a scoop of all the flavors that we wanted to try. Honestly, we could've had our fill from just the samples but they were just too freakin good. She was patient and took the time to chat with us which I really appreciated.2star: Flavors. This is no ordinary ice cream shop with your typical vanilla chocolate.. its EXOTIC. By exotic I mean, pink guava, black sesame, durian, taro, lychee, mango, green tea, etc etc. No where else in the Las Vegas valley have I found these flavors at an ice cream shop. ANNNNNDDD all are hand made by the owner. What I liked most about it was that all the flavors weren't overly sweet.. you mainly got the flavor. 3star: Price. Cheap cheap cheap. 1 scoop was about $2.50 and the prices go up from there. They also offer waffle bowls and other toppings and you can also get a pint to take home for less than $5 bucks. Thats freakin awesome.4star: Atmosphere. Though the shop is small, there are table and chairs. The lady honestly didn't mind us sitting for half an hour just chatting. In fact, she even came and chatted with us. I can definitely see this as a hang out spot to meet with friends over some ice cream and boba. Especially during the summer time. 5star: Just because I feel like it. They are great!!!Please don't let this place die!! This ice cream shop needs to stay open forever!!!** My favorite was the black sesame
",1,"so i am going to tell you exactly why i gave this place 5 stars.1star: customer service. the filipino lady working here is pretty awesome. i came in with 3 other friends and of course we asked for samples. :p she pretty much gave us a scoop of all the flavors that we wanted to try. honestly, we could have had our fill from just the samples but they were just too freakin good. she was patient and took the time to chat with us which i really appreciated.2star: flavors. this is no ordinary ice cream shop with your typical vanilla chocolate.. its exotic. by exotic i mean, pink guava, black sesame, durian, taro, lychee, mango, green tea, etc etc. no where else in the las vegas valley have i found these flavors at an ice cream shop. annnnnddd all are hand made by the owner. what i liked most about it was that all the flavors were not overly sweet.. you mainly got the flavor. 3star: price. cheap cheap cheap. 1 scoop was about $2.50 and the prices go up from there. they also offer waffle bowls and other toppings and you can also get a pint to take home for less than $5 bucks. that is freakin awesome.4star: atmosphere. though the shop is small, there are table and chairs. the lady honestly did not mind us sitting for half an hour just chatting. in fact, she even came and chatted with us. i can definitely see this as a hang out spot to meet with friends over some ice cream and boba. especially during the summer time. 5star: just because i feel like it. they are great!!!please do not let this place die!! this ice cream shop needs to stay open forever!!!** my favorite was the black sesame",go tell exactly give place 5 star 1star customer service filipino lady work pretty awesome come 3 friend course ask sample p pretty much give us scoop flavor want try honestly could fill sample freakin good patient take time chat us really appreciated 2star flavor ordinary ice cream shop typical vanilla chocolate exotic exotic mean pink guava black sesame durian taro lychee mango green tea etc etc else la vega valley find flavor ice cream shop annnnnddd hand make owner like flavor overly sweet mainly get flavor 3star price cheap cheap cheap 1 scoop 2 50 price go also offer waffle bowl topping also get pint take home less 5 buck freakin awesome 4star atmosphere though shop small table chair lady honestly mind us sit half hour chat fact even come chat us definitely see hang spot meet friend ice cream boba especially summer time 5star feel like great please let place die ice cream shop need stay open forever favorite black sesame,"{'content quality': 0.658, 'customer experience': 0.607, 'product quality': 0.536, 'value for money': 0.53, 'design and aesthetics': 0.484}","{'content quality': 0.658, 'customer experience': 0.607, 'product quality': 0.536, 'value for money': 0.53, 'design and aesthetics': 0.484}","{'content quality': 'POSITIVE', 'customer experience': 'NEGATIVE', 'product quality': 'NEGATIVE', 'value for money': 'POSITIVE', 'design and aesthetics': 'POSITIVE'}","{'content quality': 'POSITIVE', 'customer experience': 'NEGATIVE', 'product quality': 'NEGATIVE', 'value for money': 'POSITIVE', 'design and aesthetics': 'POSITIVE'}"
"On name alone we HAD to check this place out, just for kicks.Ouch!Bandaids indeed; this place hurts and not in a good way. And you might want to spritz that with some iodine for good measure.I've got no qualms with talent, don't get me wrong; the female form is a beautiful thing to behold in all of its varied curve-tastic shape and form. A woman is a woman is a beautiful woman, and I'm a sucker. By default, naked womanhood warrants an automatic 3-star baseline from me, but the slummy and desperate atmosphere in this dive is a soulsuck for all that dare enter.The squat brick building sits all by its lonesome under a tacky illuminated ""Bandaids Show Lounge"" sign, the surrounding parking lot emanating with ""damn, I'mma get mugged out here"" uncertainty and darkness.Once inside (yes, you go in through a sketchy looking front door that looks as welcoming as the sketchy looking service door), you're met by security and carded; the girls headed for the bar while another friend and myself were subjected to a [sub-standard*] pat down - *sub-standard: the folding knife clipped and visible in my front pocket (CA law) went unnoticed.  A printed ""no sideways caps, no baggysaggy jeans, no long tees"" dress code posted by the door should have been a red flag. Classy!After getting a few beers from the pretty bartender (she was actually really, really good-looking - hottest girl on staff, setting false precedent for what the stage talent would look like), we made our way past shady regulars at the bar with their necks crook'd to the lounge, finding a couple of tables near, but not next to, the center stage.Most of us sat talking and laughing with each other, occasionally glancing at the stage just to see what's up and watching the depraved humanity of the other patrons in the place, mostly empty on a Friday night...... the out-of-towner business man in the dark corner, getting dances from any girl that would come his way.... the mouth-breather waiting with stalker-ish anticipation for a dance with one of the, er, more amply-bossomed strippers.... the table of youngins, dressed exactly how the posted dress code prohibited.Girl after girl (a couple of ""a'ight"" girls, most ""everyday"" girls, and at least one ""is that a girl"" girls) came to the stage, gyrated to cliche strip club music - some exhibiting-gymnast calibre pole skills and limberness - then cruised the showroom floor, peddling their wares with a repeated-to-monotone-perfection ""...would you like a dance  ...would you like a dance"" propositioning. Sales Basics 101: Always Be Closing, rightNone of us partook in the festivities, but two friends in an adjoining party did.  One, quite simply because he was bored and someone paid for it.  The other, a recent migrant from war-torn and fundamentalist Afghanistan, got one of the [few] Barbie-esque dancers who would keep him entranced and occupied for 4-5 songs... and about $100.After a quick 30 minutes, we'd thought we'd seen the whole rotation of ""meh"" talent and skeevy behavior.  And that's when we saw it......the epitome of tacky divey strip club attire......the summation of the Bandaids experience......that's when we saw it... ...The HOOD-KINI*!It was time to leave... quickly. As we braved the parking lot,  it was joke after FirstAid-alluding and Infectious-disease related joke. Automatic hilarity at the mere mention during the rest of our trip.""Band-Aids"", because correlating ""possibility of infection"" and adult entertainment is savvy business sense.____________________Yes, yes.  A hooded bikini.In black and neon. A hood to obscure her face, while thin straps and patches of material covered her naughty bits.  A. Hooded.  Bikini.  If she were gonna take your money, she might as well look the part.
",0,"on name alone we had to check this place out, just for kicks.ouch!bandaids indeed; this place hurts and not in a good way. and you might want to spritz that with some iodine for good measure.i have got no qualms with talent, do not get me wrong; the female form is a beautiful thing to behold in all of its varied curve-tastic shape and form. a woman is a woman is a beautiful woman, and i am a sucker. by default, naked womanhood warrants an automatic 3-star baseline from me, but the slummy and desperate atmosphere in this dive is a soulsuck for all that dare enter.the squat brick building sits all by its lonesome under a tacky illuminated ""bandaids show lounge"" sign, the surrounding parking lot emanating with ""damn, i'mma get mugged out here"" uncertainty and darkness.once inside (yes, you go in through a sketchy looking front door that looks as welcoming as the sketchy looking service door), you are met by security and carded; the girls headed for the bar while another friend and myself were subjected to a [sub-standard*] pat down - *sub-standard: the folding knife clipped and visible in my front pocket (ca law) went unnoticed. a printed ""no sideways caps, no baggysaggy jeans, no long tees"" dress code posted by the door should have been a red flag. classy!after getting a few beers from the pretty bartender (she was actually really, really good-looking - hottest girl on staff, setting false precedent for what the stage talent would look like), we made our way past shady regulars at the bar with their necks crook'd to the lounge, finding a couple of tables near, but not next to, the center stage.most of us sat talking and laughing with each other, occasionally glancing at the stage just to see what is up and watching the depraved humanity of the other patrons in the place, mostly empty on a friday night...... the out-of-towner business man in the dark corner, getting dances from any girl that would come his way.... the mouth-breather waiting with stalker-ish anticipation for a dance with one of the, er, more amply-bossomed strippers.... the table of youngins, dressed exactly how the posted dress code prohibited.girl after girl (a couple of ""a'ight"" girls, most ""everyday"" girls, and at least one ""is that a girl"" girls) came to the stage, gyrated to cliche strip club music - some exhibiting-gymnast calibre pole skills and limberness - then cruised the showroom floor, peddling their wares with a repeated-to-monotone-perfection ""...would you like a dance ...would you like a dance"" propositioning. sales basics 101: always be closing, rightnone of us partook in the festivities, but two friends in an adjoining party did. one, quite simply because he was bored and someone paid for it. the other, a recent migrant from war-torn and fundamentalist afghanistan, got one of the [few] barbie-esque dancers who would keep him entranced and occupied for 4-5 songs... and about $100.after a quick 30 minutes, we would thought we would seen the whole rotation of ""meh"" talent and skeevy behavior. and that is when we saw it......the epitome of tacky divey strip club attire......the summation of the bandaids experience......that is when we saw it... ...the hood-kini*!it was time to leave... quickly. as we braved the parking lot, it was joke after firstaid-alluding and infectious-disease related joke. automatic hilarity at the mere mention during the rest of our trip.""band-aids"", because correlating ""possibility of infection"" and adult entertainment is savvy business sense.____________________yes, yes. a hooded bikini.in black and neon. a hood to obscure her face, while thin straps and patches of material covered her naughty bits. a. hooded. bikini. if she were going to take your money, she might as well look the part.",name alone check place kick ouch bandaids indeed place hurt good way might want spritz iodine good measure get qualm talent get wrong female form beautiful thing behold varied curve tastic shape form woman woman beautiful woman sucker default naked womanhood warrant automatic 3 star baseline slummy desperate atmosphere dive soulsuck dare enter squat brick build sits lonesome tacky illuminated bandaids show lounge sign surround parking lot emanate damn mma get mug uncertainty darkness inside yes go sketchy look front door look welcoming sketchy look service door meet security card girl head bar another friend subject sub standard pat sub standard folding knife clip visible front pocket ca law go unnoticed printed sideways cap baggysaggy jean long tee dress code post door red flag classy get beer pretty bartender actually really really good look hot girl staff set false precedent stage talent would look like make way past shady regular bar neck crook lounge find couple table near next center stage us sit talk laugh occasionally glance stage see watch depraved humanity patron place mostly empty friday night towner business man dark corner get dance girl would come way mouth breather wait stalker ish anticipation dance one er amply bossomed stripper table youngins dress exactly posted dress code prohibit girl girl couple ight girl everyday girl least one girl girl come stage gyrate cliche strip club music exhibit gymnast calibre pole skill limberness cruise showroom floor peddle ware repeat monotone perfection would like dance would like dance proposition sale basic 101 always close rightnone us partake festivity two friend adjoin party one quite simply bore someone pay recent migrant war torn fundamentalist afghanistan get one barbie esque dancer would keep entranced occupy 4 5 song 100 quick 30 minute would think would see whole rotation meh talent skeevy behavior saw epitome tacky divey strip club attire summation bandaids experience saw hood kini time leave quickly brave parking lot joke firstaid alluding infectious disease relate joke automatic hilarity mere mention rest trip band aid correlate possibility infection adult entertainment savvy business sense yes yes hooded bikini black neon hood obscure face thin strap patch material cover naughty bit hood bikini go take money might well look part,"{'design and aesthetics': 0.894, 'content quality': 0.618}","{'design and aesthetics': 0.894, 'content quality': 0.618}","{'design and aesthetics': 'NEGATIVE', 'content quality': 'POSITIVE'}","{'design and aesthetics': 'NEGATIVE', 'content quality': 'POSITIVE'}"
"This is one of the greatest restaurants I have ever been to and I wish to god I had the kind of wit and vocabulary to accurately reflect the really really REALLY good meal I had here.  As soon as i walked in, I felt really special, which sounds corny and laughably pathetic but I'm not kidding...I felt like one of Angelina Jolie's adopted kids...really special.  The host was a chipper fellow who whisked our coats away and took us to our cozy nook on the second tier in full view of the slate waterfall cascading down the full length of the 3 story restaurant.  I was mesmerized.  Our waitress was a sophisticated, demure lady who catered to our every need and helped us navigate the wonderfully creative menu.We were given yummy complimentary scallop appetizers over baby veggies.  My sister and I immediately looked at each other and knew this was gonna be goodddddd...I would spell out every dish and how friggin' awesome it was but I'll post pictures instead...even the one of me crying at the end of the meal.  Be sure to read the captions...The bathroom was gorgeous showcasing cutting-edge design concepts which had me convinced there was a hidden camera shooting me for the next ""Bold look of Kohler"" commercial (in the non-creepiest way...I do realize I'm talking about hidden cameras in a public bathroom).I might have scoffed at my little sister for going to school in a sketchy place like Pittsburgh, but quite honestly, I just need to shut up and visit her more often.
",1,"this is one of the greatest restaurants i have ever been to and i wish to god i had the kind of wit and vocabulary to accurately reflect the really really really good meal i had here. as soon as i walked in, i felt really special, which sounds corny and laughably pathetic but i am not kidding...i felt like one of angelina jolie's adopted kids...really special. the host was a chipper fellow who whisked our coats away and took us to our cozy nook on the second tier in full view of the slate waterfall cascading down the full length of the 3 story restaurant. i was mesmerized. our waitress was a sophisticated, demure lady who catered to our every need and helped us navigate the wonderfully creative menu.we were given yummy complimentary scallop appetizers over baby veggies. my sister and i immediately looked at each other and knew this was going to be goodddddd...i would spell out every dish and how friggin' awesome it was but i will post pictures instead...even the one of me crying at the end of the meal. be sure to read the captions...the bathroom was gorgeous showcasing cutting-edge design concepts which had me convinced there was a hidden camera shooting me for the next ""bold look of kohler"" commercial (in the non-creepiest way...i do realize i am talking about hidden cameras in a public bathroom).i might have scoffed at my little sister for going to school in a sketchy place like pittsburgh, but quite honestly, i just need to shut up and visit her more often.",one great restaurant ever wish god kind wit vocabulary accurately reflect really really really good meal soon walk felt really special sound corny laughably pathetic kid felt like one angelina jolie adopt kid really special host chipper fellow whisk coat away take us cozy nook second tier full view slate waterfall cascade full length 3 story restaurant mesmerize waitress sophisticated demure lady cater every need help us navigate wonderfully creative menu give yummy complimentary scallop appetizer baby veggie sister immediately look know go goodddddd would spell every dish friggin awesome post picture instead even one cry end meal sure read caption bathroom gorgeous showcasing cut edge design concept convince hidden camera shoot next bold look kohler commercial non creepy way realize talk hidden camera public bathroom might scoff little sister go school sketchy place like pittsburgh quite honestly need shut visit often,"{'content quality': 0.583, 'design and aesthetics': 0.46}","{'content quality': 0.583, 'design and aesthetics': 0.46}","{'content quality': 'POSITIVE', 'design and aesthetics': 'POSITIVE'}","{'content quality': 'POSITIVE', 'design and aesthetics': 'POSITIVE'}"
"Bought a Groupon here to try it out, and decided to buy another because we knew we'd come back!Go for dinner, sit outside, and enjoy an amazing view of downtown, something you can't really get from many uptown restaurants. Views of many buildings, but set back from the street, just a really great location for evening.Sushi: they have interesting rolls like ones with sweet potatoes that I've never seen any where else. Really yummy sushi of all types.Drinks: really good mixed drinks and sake! Limited wine and beer.Service: Truly excellent!
",1,"bought a groupon here to try it out, and decided to buy another because we knew we would come back!go for dinner, sit outside, and enjoy an amazing view of downtown, something you cannot really get from many uptown restaurants. views of many buildings, but set back from the street, just a really great location for evening.sushi: they have interesting rolls like ones with sweet potatoes that i have never seen any where else. really yummy sushi of all types.drinks: really good mixed drinks and sake! limited wine and beer.service: truly excellent!",buy groupon try decide buy another know would come back go dinner sit outside enjoy amazing view downtown something really get many uptown restaurant view many building set back street really great location even sushi interest roll like one sweet potato never see else really yummy sushi type drink really good mixed drink sake limited wine beer service truly excellent,"{'content quality': 0.903, 'value for money': 0.899, 'product quality': 0.788, 'design and aesthetics': 0.619, 'functionality': 0.462}","{'content quality': 0.903, 'value for money': 0.899, 'product quality': 0.788, 'design and aesthetics': 0.619, 'functionality': 0.462}","{'content quality': 'POSITIVE', 'value for money': 'POSITIVE', 'product quality': 'POSITIVE', 'design and aesthetics': 'POSITIVE', 'functionality': 'POSITIVE'}","{'content quality': 'POSITIVE', 'value for money': 'POSITIVE', 'product quality': 'POSITIVE', 'design and aesthetics': 'POSITIVE', 'functionality': 'POSITIVE'}"
"First time here was Leather and Lace night in Oct. 2009. Finally an adult place to have adult fun. Not a bunch of college kids goofing around and giggling like fetish night at The Cardinal. This was much more mature and so much fun! Everyone friendly. So many beautiful sexy people. Loved the guy in the mesh shirt, hee hee! Ended up getting quite naughty and I cannot wait to return. I thought it was much larger than I expected, with the dance floor in the front, the middle area bar, and then the whole area in the back with two more bars there.Finally I have a place to go play!Kissy
",1,"first time here was leather and lace night in october 2009. finally an adult place to have adult fun. not a bunch of college kids goofing around and giggling like fetish night at the cardinal. this was much more mature and so much fun! everyone friendly. so many beautiful sexy people. loved the guy in the mesh shirt, hee hee! ended up getting quite naughty and i cannot wait to return. i thought it was much larger than i expected, with the dance floor in the front, the middle area bar, and then the whole area in the back with two more bars there.finally i have a place to go play!kissy",first time leather lace night october 2009 finally adult place adult fun bunch college kid goof around giggle like fetish night cardinal much mature much fun everyone friendly many beautiful sexy people love guy mesh shirt hee hee end get quite naughty wait return think much large expect dance floor front middle area bar whole area back two bar finally place go play kissy,"{'design and aesthetics': 0.908, 'content quality': 0.744}","{'design and aesthetics': 0.908, 'content quality': 0.744}","{'design and aesthetics': 'POSITIVE', 'content quality': 'POSITIVE'}","{'design and aesthetics': 'POSITIVE', 'content quality': 'POSITIVE'}"
"Such a great store. They stock everything (EVERYTHING), including: cards, hand puppets, necklaces, books, etc... Kards Unlimited seems to take great care in choosing store products for sale. Definitely my favorite store on Walnut.
",1,"such a great store. they stock everything (everything), including: cards, hand puppets, necklaces, books, etc... kards unlimited seems to take great care in choosing store products for sale. definitely my favorite store on walnut.",great store stock everything everything include card hand puppet necklace book etc kards unlimited seem take great care choose store product sale definitely favorite store walnut,{'design and aesthetics': 0.559},{'design and aesthetics': 0.559},{'design and aesthetics': 'POSITIVE'},{'design and aesthetics': 'POSITIVE'}
"My wife booked my son and I for a fatherSon weekend to the GiantsPanthers game. I had no idea a Holiday Inn could be so nice. It offered everything the top hotels had in my years of traveling. The decor, room, location were all 5 stars! The front desk and valet parking were top notch! I needed to charge my phone and iPad before the game and the valet brought my car down so we could sit and charge it. After we were done he parked it again with a smile.We will absolutely be back! Thank you for a wonderful stay!
",1,"my wife booked my son and i for a fatherson weekend to the giantspanthers game. i had no idea a holiday inn could be so nice. it offered everything the top hotels had in my years of traveling. the decor, room, location were all 5 stars! the front desk and valet parking were top notch! i needed to charge my phone and ipad before the game and the valet brought my car down so we could sit and charge it. after we were done he parked it again with a smile.we will absolutely be back! thank you for a wonderful stay!",wife book son fatherson weekend giantspanthers game idea holiday inn could nice offer everything top hotel year travel decor room location 5 star front desk valet parking top notch need charge phone ipad game valet bring car could sit charge park smile absolutely back thank wonderful stay,"{'design and aesthetics': 0.971, 'value for money': 0.95, 'functionality': 0.921, 'content quality': 0.916, 'customer experience': 0.678, 'product quality': 0.674}","{'design and aesthetics': 0.971, 'value for money': 0.95, 'functionality': 0.921, 'content quality': 0.916, 'customer experience': 0.678, 'product quality': 0.674}","{'design and aesthetics': 'POSITIVE', 'value for money': 'POSITIVE', 'functionality': 'NEGATIVE', 'content quality': 'NEUTRAL', 'customer experience': 'POSITIVE', 'product quality': 'POSITIVE'}","{'design and aesthetics': 'POSITIVE', 'value for money': 'POSITIVE', 'functionality': 'NEGATIVE', 'content quality': 'NEUTRAL', 'customer experience': 'POSITIVE', 'product quality': 'POSITIVE'}"
