review,class,text_for_models,text_for_stats,detected_aspects,aspects_parsed,aspect_sentiments,sentiments_parsed
"Wow my Mom,husband and I had dinner there yesterday from a ad in the paper with Valentine's specials for the whole month of February. We ordered the Surf and Turf special. It started with a salad I had their classic which was HUGE and SUPER DELISH !!! The classic salad was a generous amount of spring mix,tomato,cucumber,purple onion,peppercini.   They have so many salad dressing choices not your ordinary blahzay boring choices. The spinach salad was also AMAZING spinach walnuts,feta,cranberries. The Caesar is what you would expect generous portion but average.Then a soup choice of French onion or soup de jour  (soup of the day) my husband had the french onion Wow he said it was prepared perfect and how french onion should be served a nice crock full and nice amount of cheese covering and balance of bread and soup. My mom and I had the soup of the day which was a roasted red pepper mushroom soup this was a soup we had never experienced and boy was it fabbie definitely a soup we shall enjoy again.Now the main course.a 6 oz Filet Mignon and 4-5 oz Lobster tail , Twice baked potato, Fresh white asparagus. The steak was cooked PERFECT my Mom and I ordered med rare my husband ordered his med and there was not an issue with either.If all this wasn't enough choice of homemade desserts  was carrot cake    or brownie a la mode.we all chose the brownie a la mode. It was HUGE the brownie was like a 4x4 brownie with a HUGE scoop of ice cream. Service was EXCELLENT our waitress was on top of things couldn't ask for better what an amazing establishment ! A true hidden GEM !!! All of this for 19.99 !!!!
",1,"wow my mom,husband and i had dinner there yesterday from a ad in the paper with valentine's specials for the whole month of february. we ordered the surf and turf special. it started with a salad i had their classic which was huge and super delish !!! the classic salad was a generous amount of spring mix,tomato,cucumber,purple onion,peppercini. they have so many salad dressing choices not your ordinary blahzay boring choices. the spinach salad was also amazing spinach walnuts,feta,cranberries. the caesar is what you would expect generous portion but average.then a soup choice of french onion or soup de jour (soup of the day) my husband had the french onion wow he said it was prepared perfect and how french onion should be served a nice crock full and nice amount of cheese covering and balance of bread and soup. my mom and i had the soup of the day which was a roasted red pepper mushroom soup this was a soup we had never experienced and boy was it fabbie definitely a soup we shall enjoy again.now the main course.a 6 oz filet mignon and 4-5 oz lobster tail , twice baked potato, fresh white asparagus. the steak was cooked perfect my mom and i ordered med rare my husband ordered his med and there was not an issue with either.if all this was not enough choice of homemade desserts was carrot cake or brownie a la mode.we all chose the brownie a la mode. it was huge the brownie was like a 4x4 brownie with a huge scoop of ice cream. service was excellent our waitress was on top of things could not ask for better what an amazing establishment ! a true hidden gem !!! all of this for 19.99 !!!!",wow mom husband dinner yesterday ad paper valentine special whole month february order surf turf special start salad classic huge super delish classic salad generous amount spring mix tomato cucumber purple onion peppercini many salad dress choice ordinary blahzay boring choices spinach salad also amaze spinach walnut feta cranberry caesar would expect generous portion average soup choice french onion soup de jour soup day husband french onion wow say prepare perfect french onion serve nice crock full nice amount cheese cover balance bread soup mom soup day roasted red pepper mushroom soup soup never experience boy fabbie definitely soup shall enjoy main course 6 oz filet mignon 4 5 oz lobster tail twice bake potato fresh white asparagus steak cook perfect mom order med rare husband order med issue either enough choice homemade dessert carrot cake brownie la mode choose brownie la mode huge brownie like 4x4 brownie huge scoop ice cream service excellent waitress top thing could ask good amazing establishment true hidden gem 19 99,"{'product quality': 0.854, 'value for money': 0.835, 'design and aesthetics': 0.811, 'content quality': 0.668}","{'product quality': 0.854, 'value for money': 0.835, 'design and aesthetics': 0.811, 'content quality': 0.668}","{'product quality': 'POSITIVE', 'value for money': 'POSITIVE', 'design and aesthetics': 'POSITIVE', 'content quality': 'POSITIVE'}","{'product quality': 'POSITIVE', 'value for money': 'POSITIVE', 'design and aesthetics': 'POSITIVE', 'content quality': 'POSITIVE'}"
"Took their free class. Really helped to get us started brewing. Now we're on our third batch in and the staff has been nothing but helpful. Their kits make it easy to get started as well. Go try it out!
",1,took their free class. really helped to get us started brewing. now we are on our third batch in and the staff has been nothing but helpful. their kits make it easy to get started as well. go try it out!,take free class really help get us started brewing third batch staff nothing helpful kit make easy get start well go try,{'product quality': 0.573},{'product quality': 0.573},{'product quality': 'POSITIVE'},{'product quality': 'POSITIVE'}
"My mother has been at four different rehab centers in Las Vegas over the past 1 12 years...and for the last several months, we have been at TLC. We could not be happier with the service, staff and environment. There is always a doctor on staff, which is very hard to find in a rehab...the nurses are very knowledgeable, courteous and attentive...and have been dedicated to giving my mother consistent attention. I would highly recommend this facility to anyone who deeply cares about where their loved one is placed. We can't be grateful and thankful enough.
",1,"my mother has been at four different rehab centers in las vegas over the past 1 12 years...and for the last several months, we have been at tlc. we could not be happier with the service, staff and environment. there is always a doctor on staff, which is very hard to find in a rehab...the nurses are very knowledgeable, courteous and attentive...and have been dedicated to giving my mother consistent attention. i would highly recommend this facility to anyone who deeply cares about where their loved one is placed. we cannot be grateful and thankful enough.",mother four different rehab center la vega past 1 12 year last several month tlc could happy service staff environment always doctor staff hard find rehab nurse knowledgeable courteous attentive dedicate give mother consistent attention would highly recommend facility anyone deeply care loved one place grateful thankful enough,{},{},{},{}
"I purchased a gift certificate up front from them only to find out that they were never going to let me use it.    I kept calling to try to make appointments and each time I called, the staff was rude and said that they had no appointments.    My gift certificate expired because they never had any appointments available (or so they said) and when I explained my situation to them over the phone, they were extremely rude.    I said that I would tell my friends and family about my awful experience there and about how they took my money but never provided services to me.    The staff said something extremely rude to me over the phone and then hung up.I will never give this salon my money again.     It's a shame that I'm out 50 bucks and have nothing to show for it.     I was scammed.
",0,"i purchased a gift certificate up front from them only to find out that they were never going to let me use it. i kept calling to try to make appointments and each time i called, the staff was rude and said that they had no appointments. my gift certificate expired because they never had any appointments available (or so they said) and when i explained my situation to them over the phone, they were extremely rude. i said that i would tell my friends and family about my awful experience there and about how they took my money but never provided services to me. the staff said something extremely rude to me over the phone and then hung up.i will never give this salon my money again. it is a shame that i am out 50 bucks and have nothing to show for it. i was scammed.",purchase gift certificate front find never go let use keep call try make appointment time call staff rude say appointment gift certificate expire never appointment available say explain situation phone extremely rude say would tell friend family awful experience take money never provide service staff say something extremely rude phone hang never give salon money shame 50 buck nothing show scammed,"{'value for money': 0.702, 'customer experience': 0.606}","{'value for money': 0.702, 'customer experience': 0.606}","{'value for money': 'NEGATIVE', 'customer experience': 'NEGATIVE'}","{'value for money': 'NEGATIVE', 'customer experience': 'NEGATIVE'}"
"Love the neighborhood everyone is friendly to me :D
",1,love the neighborhood everyone is friendly to me :d,love neighborhood everyone friendly,{},{},{},{}
"They were great and helpful.  We had our youth soccer shirts done here. They got the shirts to me on time and exactly how I wanted them to be. Very affordable and would definitely recommend them.
",1,they were great and helpful. we had our youth soccer shirts done here. they got the shirts to me on time and exactly how i wanted them to be. very affordable and would definitely recommend them.,great helpful youth soccer shirt get shirt time exactly want affordable would definitely recommend,"{'value for money': 0.948, 'product quality': 0.815, 'design and aesthetics': 0.736}","{'value for money': 0.948, 'product quality': 0.815, 'design and aesthetics': 0.736}","{'value for money': 'POSITIVE', 'product quality': 'POSITIVE', 'design and aesthetics': 'POSITIVE'}","{'value for money': 'POSITIVE', 'product quality': 'POSITIVE', 'design and aesthetics': 'POSITIVE'}"
"Actually doesn't even deserve one star.  The whole time they asked if I wanted this and that extra.  I did give in and got $33 pedicure which includes callus remover.  I got home and my feet look exactly the same.  They also charged $3 for shiny buff which looks like CRAPPPPPPPP.  Oh and at the end my bill being $83 they tell me they need cash or check or I can use their ATM for $1 charge.  After a little while she then decides it is ok to use my card.  I am so disappointed with this place, especially taking my mom here for Mother's Day.  The one lady also had nerve to say that I should pay and I am rich.  WOW!!  Thankfully I am employed and am able to pay but cant imagine if I couldn't.  Anyway,  PLEASE PLEASE don't waste your time nor money here.  They can care less what your nails look like.
",0,"actually does not even deserve one star. the whole time they asked if i wanted this and that extra. i did give in and got $33 pedicure which includes callus remover. i got home and my feet look exactly the same. they also charged $3 for shiny buff which looks like crapppppppp. oh and at the end my bill being $83 they tell me they need cash or check or i can use their atm for $1 charge. after a little while she then decides it is ok to use my card. i am so disappointed with this place, especially taking my mom here for mother's day. the one lady also had nerve to say that i should pay and i am rich. wow!! thankfully i am employed and am able to pay but cannot imagine if i could not. anyway, please please do not waste your time nor money here. they can care less what your nails look like.",actually even deserve one star whole time ask want extra give get 33 pedicure include callus remover get home foot look exactly also charge 3 shiny buff look like crapppppppp oh end bill 83 tell need cash check use atm 1 charge little decide ok use card disappointed place especially take mom mother day one lady also nerve say pay rich wow thankfully employ able pay imagine could anyway please please waste time money care less nails look like,"{'value for money': 0.991, 'design and aesthetics': 0.951, 'customer experience': 0.847, 'content quality': 0.711, 'product quality': 0.48}","{'value for money': 0.991, 'design and aesthetics': 0.951, 'customer experience': 0.847, 'content quality': 0.711, 'product quality': 0.48}","{'value for money': 'POSITIVE', 'design and aesthetics': 'NEGATIVE', 'customer experience': 'NEGATIVE', 'content quality': 'NEGATIVE', 'product quality': 'NEGATIVE'}","{'value for money': 'POSITIVE', 'design and aesthetics': 'NEGATIVE', 'customer experience': 'NEGATIVE', 'content quality': 'NEGATIVE', 'product quality': 'NEGATIVE'}"
"This store has treated me so well since April of 2013, I buy a lot of suitsshirts and they have always been a pleasure to deal with. Jason is really nice and the rest of the staff has always been easy to deal with and very kind. I highly recommend this store, and definitely getting your suits tailored here as well!
",1,"this store has treated me so well since april of 2013, i buy a lot of suitsshirts and they have always been a pleasure to deal with. jason is really nice and the rest of the staff has always been easy to deal with and very kind. i highly recommend this store, and definitely getting your suits tailored here as well!",store treat well since april 2013 buy lot suitsshirts always pleasure deal jason really nice rest staff always easy deal kind highly recommend store definitely get suit tailor well,"{'design and aesthetics': 0.842, 'value for money': 0.641}","{'design and aesthetics': 0.842, 'value for money': 0.641}","{'design and aesthetics': 'POSITIVE', 'value for money': 'POSITIVE'}","{'design and aesthetics': 'POSITIVE', 'value for money': 'POSITIVE'}"
"I have live around this area all my life and My family would go here and I would always decline to go, that is until Saturday my brother asked me if I wanted to go to breakfast and I had to say yes (just posted on facebook that I wanted to go to breakfast and nobody wanted to go with me) Lets get to the review I am glad I said yes there homefries are awesome the eggs were just right. I would definitely go here again.
",1,"i have live around this area all my life and my family would go here and i would always decline to go, that is until saturday my brother asked me if i wanted to go to breakfast and i had to say yes (just posted on facebook that i wanted to go to breakfast and nobody wanted to go with me) let us get to the review i am glad i said yes there homefries are awesome the eggs were just right. i would definitely go here again.",live around area life family would go would always decline go saturday brother ask want go breakfast say yes post facebook want go breakfast nobody want go let us get review glad say yes homefries awesome egg right would definitely go,{},{},{},{}
"Wow, well done.   Service, food was amazing, I'm coming back for sure.  The atmosphere is beautiful with trendy art work.   You will leave happy and full.  And guarantee you'll be back.   I've eaten at Shabu Fondue restaurants all over and I have to say this is one of the best
",1,"wow, well done. service, food was amazing, i am coming back for sure. the atmosphere is beautiful with trendy art work. you will leave happy and full. and guarantee you will be back. i have eaten at shabu fondue restaurants all over and i have to say this is one of the best",wow well service food amaze come back sure atmosphere beautiful trendy art work leave happy full guarantee back eat shabu fondue restaurant say one best,"{'design and aesthetics': 0.986, 'product quality': 0.732, 'content quality': 0.643}","{'design and aesthetics': 0.986, 'product quality': 0.732, 'content quality': 0.643}","{'design and aesthetics': 'POSITIVE', 'product quality': 'POSITIVE', 'content quality': 'POSITIVE'}","{'design and aesthetics': 'POSITIVE', 'product quality': 'POSITIVE', 'content quality': 'POSITIVE'}"
"Went there with two friends on a trip to Vegas and it was wonderful.  Atmosphere top notch. Staff was professional and friendly and prices reasonable.  Definite stop in vegas!
",1,went there with two friends on a trip to vegas and it was wonderful. atmosphere top notch. staff was professional and friendly and prices reasonable. definite stop in vegas!,go two friend trip vegas wonderful atmosphere top notch staff professional friendly price reasonable definite stop vega,"{'value for money': 0.983, 'content quality': 0.734}","{'value for money': 0.983, 'content quality': 0.734}","{'value for money': 'POSITIVE', 'content quality': 'POSITIVE'}","{'value for money': 'POSITIVE', 'content quality': 'POSITIVE'}"
"Twenty-three people were in front of us (yes, I count sometimes) waiting for the doors to open at 1:00pm on a weekday and there is not even a concert, no ""New Release"" Party!  This is a popular place!This is my new Favorite place to shop for MusicDVDs and LOOK, which means I'm more than a fan of the patrons here!  In a popular shop this size it is easy to be inspired in very appropriate ways.  If you like what is in here there is a good chance you could meet someone who has similar taste... Enough about dating!They still have bands doing shows here too!  Small Live Music Venue... Very Cool!   For the size of the store they have a GIGANTIC Punk section and even for a store much larger they have a Huge Punk section.  After being here a little while it was easy to understand they only sell the cool Movies and Music.  I found more that I liked here than in several stores combined!  This time I found two DVDs that I thought I may not be able to find so easily and for only $4.00 each, one French and one Thai.  I felt more than lucky, more like Fortunate!
",1,"twenty-three people were in front of us (yes, i count sometimes) waiting for the doors to open at 1:00pm on a weekday and there is not even a concert, no ""new release"" party! this is a popular place!this is my new favorite place to shop for musicdvds and look, which means i am more than a fan of the patrons here! in a popular shop this size it is easy to be inspired in very appropriate ways. if you like what is in here there is a good chance you could meet someone who has similar taste... enough about dating!they still have bands doing shows here too! small live music venue... very cool! for the size of the store they have a gigantic punk section and even for a store much larger they have a huge punk section. after being here a little while it was easy to understand they only sell the cool movies and music. i found more that i liked here than in several stores combined! this time i found two dvds that i thought i may not be able to find so easily and for only $4.00 each, one french and one thai. i felt more than lucky, more like fortunate!",twenty three people front us yes count sometimes wait door open 1 00pm weekday even concert new release party popular place new favorite place shop musicdvds look mean fan patron popular shop size easy inspire appropriate way like good chance could meet someone similar taste enough date still band show small live music venue cool size store gigantic punk section even store much large huge punk section little easy understand sell cool movie music find like several store combine time find two dvd think may able find easily 4 00 one french one thai felt lucky like fortunate,"{'content quality': 0.774, 'design and aesthetics': 0.589}","{'content quality': 0.774, 'design and aesthetics': 0.589}","{'content quality': 'POSITIVE', 'design and aesthetics': 'POSITIVE'}","{'content quality': 'POSITIVE', 'design and aesthetics': 'POSITIVE'}"
"Stay away.  Far away.  Go if you want to be insulted and not valued as a customer.We went with a group on a Wed (very slow) night to listen to some music and have a nightcap.We left when we were told ""you are the oldest people here"" (we are in our 40's) and didn't care to sing along to a song before our time.The manager even apologized for the poor form of the piano players. If they were astute business people, they would have realized that their ""oldest"" customers had the most amount of disposable income to spend there.   As such, we took our money and found another place where they welcomed our business.Never again.
",0,"stay away. far away. go if you want to be insulted and not valued as a customer.we went with a group on a wed (very slow) night to listen to some music and have a nightcap.we left when we were told ""you are the oldest people here"" (we are in our 40's) and did not care to sing along to a song before our time.the manager even apologized for the poor form of the piano players. if they were astute business people, they would have realized that their ""oldest"" customers had the most amount of disposable income to spend there. as such, we took our money and found another place where they welcomed our business.never again.",stay away far away go want insult value customer go group wed slow night listen music nightcap leave tell old people 40 care sing along song time manager even apologize poor form piano player astute business people would realize old customer amount disposable income spend take money find another place welcome business never,"{'content quality': 0.893, 'value for money': 0.497}","{'content quality': 0.893, 'value for money': 0.497}","{'content quality': 'NEGATIVE', 'value for money': 'NEGATIVE'}","{'content quality': 'NEGATIVE', 'value for money': 'NEGATIVE'}"
"thisis not the closest Kings to us, but we often will travel the extra miles because the service and food at this location is always the best.
",1,"thisis not the closest kings to us, but we often will travel the extra miles because the service and food at this location is always the best.",thisis close king us often travel extra mile service food location always best,{},{},{},{}
"I was beyond impressed with the level of dedication these coaches have!  The programs are top notch and the kids actually learn to develop inner strength along with their physical strength.  SO much better than babysitting them with video games!The fees are so reasonable, I really am amazed at the quality of what these kids are learning.  I LOVE that this is available in times like these, and especially in this kind of weather!
",1,"i was beyond impressed with the level of dedication these coaches have! the programs are top notch and the kids actually learn to develop inner strength along with their physical strength. so much better than babysitting them with video games!the fees are so reasonable, i really am amazed at the quality of what these kids are learning. i love that this is available in times like these, and especially in this kind of weather!",beyond impressed level dedication coach program top notch kid actually learn develop inner strength along physical strength much good babysitting video game fee reasonable really amaze quality kid learn love available time like especially kind weather,"{'value for money': 0.972, 'product quality': 0.533}","{'value for money': 0.972, 'product quality': 0.533}","{'value for money': 'POSITIVE', 'product quality': 'POSITIVE'}","{'value for money': 'POSITIVE', 'product quality': 'POSITIVE'}"
"My boyfriend and I made a trip to Wisconsin Dells for my birthday and stopped here on the way back to Chicago to get some cheese. All of the employees here were extremely helpful and friendly. Cheese was decent priced and delicious. I'd recommend it.
",1,my boyfriend and i made a trip to wisconsin dells for my birthday and stopped here on the way back to chicago to get some cheese. all of the employees here were extremely helpful and friendly. cheese was decent priced and delicious. i would recommend it.,boyfriend make trip wisconsin dell birthday stop way back chicago get cheese employee extremely helpful friendly cheese decent price delicious would recommend,"{'value for money': 0.951, 'product quality': 0.686, 'customer experience': 0.537}","{'value for money': 0.951, 'product quality': 0.686, 'customer experience': 0.537}","{'value for money': 'POSITIVE', 'product quality': 'POSITIVE', 'customer experience': 'POSITIVE'}","{'value for money': 'POSITIVE', 'product quality': 'POSITIVE', 'customer experience': 'POSITIVE'}"
"Trust Tim & Brenda to handle all your embroidery needs.  They have embroidered multiple items multiple times for my business, and the transactions are always flawless.  They also do screen printing which may be an option we use in the future.  Thanks Brenda and Tim treating me like close family!
",1,"trust tim & brenda to handle all your embroidery needs. they have embroidered multiple items multiple times for my business, and the transactions are always flawless. they also do screen printing which may be an option we use in the future. thanks brenda and tim treating me like close family!",trust tim brenda handle embroidery need embroider multiple item multiple time business transaction always flawless also screen print may option use future thanks brenda tim treat like close family,{},{},{},{}
"I love this place! I came here ALL the time. The staff is always really friendly and even when there really busy I have never had to wait long for my drink to be made.
",1,i love this place! i came here all the time. the staff is always really friendly and even when there really busy i have never had to wait long for my drink to be made.,love place come time staff always really friendly even really busy never wait long drink make,{},{},{},{}
